{
  "schema_version": "1.0.0",
  "study_id": "study_cross_cultural_v1",
  "questionnaire_version": "1.0.0",
  "source_language": "zh-Hans",
  "supported_languages": ["zh-Hans", "en", "ja", "ko"],
  "status": "draft_unreviewed",
  "modules": [
    "information_consent",
    "eligibility",
    "language_scripts",
    "training_exposure",
    "device_practice",
    "visual_ratings",
    "recognition",
    "quality",
    "optional_feedback",
    "completion_withdrawal"
  ],
  "scale_definitions": {
    "likert_1_7": {
      "minimum": 1,
      "maximum": 7,
      "missing_codes": ["not_applicable", "refused"],
      "anchors": {
        "zh-Hans": {"low": "完全不", "mid": "中立", "high": "非常", "not_applicable": "不适用/无法判断", "refused": "不愿回答"},
        "en": {"low": "Not at all", "mid": "Neutral", "high": "Very much", "not_applicable": "Not applicable / cannot judge", "refused": "Prefer not to answer"},
        "ja": {"low": "まったくそう思わない", "mid": "どちらでもない", "high": "非常にそう思う", "not_applicable": "該当しない／判断できない", "refused": "回答しない"},
        "ko": {"low": "전혀 그렇지 않다", "mid": "보통이다", "high": "매우 그렇다", "not_applicable": "해당 없음 / 판단할 수 없음", "refused": "응답하지 않음"}
      }
    }
  },
  "items": [
    {
      "item_id": "item_study_information",
      "module": "information_consent",
      "construct": "study_information",
      "response_type": "information",
      "option_set": null,
      "required": true,
      "translations": {
        "zh-Hans": {"text": "本研究比较不同文字视觉形式的感知。当前版本仅用于合成工程测试，不收集真人数据。", "review_status": "source_draft"},
        "en": {"text": "This study compares perceptions of visual forms across writing systems. This version is for synthetic engineering tests only and does not collect real-person data.", "review_status": "translated_draft_unreviewed"},
        "ja": {"text": "本研究は異なる文字体系の視覚形式に対する知覚を比較します。現在の版は合成工学テスト専用で、実在する参加者のデータは収集しません。", "review_status": "translated_draft_unreviewed"},
        "ko": {"text": "이 연구는 문자 체계별 시각적 형태에 대한 인식을 비교합니다. 현재 버전은 합성 엔지니어링 테스트 전용이며 실제 참여자 데이터를 수집하지 않습니다.", "review_status": "translated_draft_unreviewed"}
      }
    },
    {
      "item_id": "item_consent",
      "module": "information_consent",
      "construct": "consent",
      "response_type": "consent",
      "option_set": "consent",
      "required": true,
      "translations": {
        "zh-Hans": {"text": "我已阅读研究信息，并同意按所示条件参加。", "review_status": "source_draft"},
        "en": {"text": "I have read the study information and agree to participate under the stated conditions.", "review_status": "translated_draft_unreviewed"},
        "ja": {"text": "研究情報を読み、記載された条件で参加することに同意します。", "review_status": "translated_draft_unreviewed"},
        "ko": {"text": "연구 정보를 읽었으며 명시된 조건에 따라 참여하는 데 동의합니다.", "review_status": "translated_draft_unreviewed"}
      }
    },
    {
      "item_id": "item_age_eligible",
      "module": "eligibility",
      "construct": "age_eligibility",
      "response_type": "single_choice",
      "option_set": "yes_no",
      "required": true,
      "translations": {
        "zh-Hans": {"text": "你是否达到经伦理批准的最低参与年龄？", "review_status": "source_draft"},
        "en": {"text": "Do you meet the minimum participation age approved by ethics review?", "review_status": "translated_draft_unreviewed"},
        "ja": {"text": "倫理審査で承認された最低参加年齢に達していますか。", "review_status": "translated_draft_unreviewed"},
        "ko": {"text": "윤리 심의에서 승인된 최소 참여 연령을 충족합니까?", "review_status": "translated_draft_unreviewed"}
      }
    },
    {
      "item_id": "item_language_understood",
      "module": "eligibility",
      "construct": "questionnaire_language_comprehension",
      "response_type": "single_choice",
      "option_set": "yes_no",
      "required": true,
      "translations": {
        "zh-Hans": {"text": "你是否能够充分理解当前问卷语言？", "review_status": "source_draft"},
        "en": {"text": "Can you understand the current questionnaire language well enough?", "review_status": "translated_draft_unreviewed"},
        "ja": {"text": "現在の質問票の言語を十分に理解できますか。", "review_status": "translated_draft_unreviewed"},
        "ko": {"text": "현재 설문 언어를 충분히 이해할 수 있습니까?", "review_status": "translated_draft_unreviewed"}
      }
    },
    {
      "item_id": "item_mother_tongues",
      "module": "language_scripts",
      "construct": "mother_tongues",
      "response_type": "multi_choice",
      "option_set": "languages",
      "required": true,
      "translations": {
        "zh-Hans": {"text": "请选择你的母语；可多选，并另行标注主要语言。", "review_status": "source_draft"},
        "en": {"text": "Select your mother tongue(s); you may select more than one and separately mark the primary language.", "review_status": "translated_draft_unreviewed"},
        "ja": {"text": "母語を選択してください。複数選択でき、主要言語は別に示します。", "review_status": "translated_draft_unreviewed"},
        "ko": {"text": "모국어를 선택하십시오. 여러 개를 선택할 수 있으며 주 언어는 별도로 표시합니다.", "review_status": "translated_draft_unreviewed"}
      }
    },
    {
      "item_id": "item_native_scripts",
      "module": "language_scripts",
      "construct": "native_scripts",
      "response_type": "multi_choice",
      "option_set": "scripts",
      "required": true,
      "translations": {
        "zh-Hans": {"text": "请选择你从小熟练使用的文字系统；可多选。", "review_status": "source_draft"},
        "en": {"text": "Select the writing system(s) you have used proficiently since childhood; multiple selections are allowed.", "review_status": "translated_draft_unreviewed"},
        "ja": {"text": "幼少期から習熟して使用している文字体系を選択してください。複数選択できます。", "review_status": "translated_draft_unreviewed"},
        "ko": {"text": "어릴 때부터 능숙하게 사용한 문자 체계를 선택하십시오. 복수 선택이 가능합니다.", "review_status": "translated_draft_unreviewed"}
      }
    },
    {
      "item_id": "item_script_proficiency",
      "module": "language_scripts",
      "construct": "script_reading_writing_exposure",
      "response_type": "single_choice",
      "option_set": "proficiency_1_7",
      "required": true,
      "translations": {
        "zh-Hans": {"text": "请分别评价你对拉丁、汉字、假名和韩文的阅读、书写与接触频率。", "review_status": "source_draft"},
        "en": {"text": "Rate reading, writing and exposure frequency separately for Latin, Han, Kana and Hangul.", "review_status": "translated_draft_unreviewed"},
        "ja": {"text": "ラテン文字、漢字、仮名、ハングルについて、読む力、書く力、接触頻度を別々に評価してください。", "review_status": "translated_draft_unreviewed"},
        "ko": {"text": "라틴, 한자, 가나, 한글 각각에 대해 읽기, 쓰기, 노출 빈도를 평가하십시오.", "review_status": "translated_draft_unreviewed"}
      }
    },
    {
      "item_id": "item_design_training",
      "module": "training_exposure",
      "construct": "design_typography_training",
      "response_type": "single_choice",
      "option_set": "training",
      "required": true,
      "translations": {
        "zh-Hans": {"text": "你的设计或字体排印训练程度是？", "review_status": "source_draft"},
        "en": {"text": "What is your level of design or typography training?", "review_status": "translated_draft_unreviewed"},
        "ja": {"text": "デザインまたはタイポグラフィの訓練経験はどの程度ですか。", "review_status": "translated_draft_unreviewed"},
        "ko": {"text": "디자인 또는 타이포그래피 교육 수준은 어느 정도입니까?", "review_status": "translated_draft_unreviewed"}
      }
    },
    {
      "item_id": "item_calligraphy_training",
      "module": "training_exposure",
      "construct": "calligraphy_training",
      "response_type": "single_choice",
      "option_set": "training",
      "required": true,
      "translations": {
        "zh-Hans": {"text": "你的书法或文字艺术训练程度是？", "review_status": "source_draft"},
        "en": {"text": "What is your level of calligraphy or lettering-arts training?", "review_status": "translated_draft_unreviewed"},
        "ja": {"text": "書道または文字芸術の訓練経験はどの程度ですか。", "review_status": "translated_draft_unreviewed"},
        "ko": {"text": "서예 또는 레터링 예술 교육 수준은 어느 정도입니까?", "review_status": "translated_draft_unreviewed"}
      }
    },
    {
      "item_id": "item_device_ready",
      "module": "device_practice",
      "construct": "device_calibration",
      "response_type": "single_choice",
      "option_set": "yes_no",
      "required": true,
      "translations": {
        "zh-Hans": {"text": "图像是否完整可见，且屏幕亮度与环境适合观看？", "review_status": "source_draft"},
        "en": {"text": "Is the image fully visible, with screen brightness and surroundings suitable for viewing?", "review_status": "translated_draft_unreviewed"},
        "ja": {"text": "画像全体が見え、画面の明るさと周囲の環境は観察に適していますか。", "review_status": "translated_draft_unreviewed"},
        "ko": {"text": "이미지 전체가 보이며 화면 밝기와 주변 환경이 관찰에 적합합니까?", "review_status": "translated_draft_unreviewed"}
      }
    },
    {
      "item_id": "item_practice_instruction",
      "module": "device_practice",
      "construct": "practice",
      "response_type": "information",
      "option_set": null,
      "required": true,
      "translations": {
        "zh-Hans": {"text": "练习题只用于熟悉操作，不进入分析。请根据第一印象作答。", "review_status": "source_draft"},
        "en": {"text": "The practice item is only for learning the controls and is not analyzed. Respond from your first impression.", "review_status": "translated_draft_unreviewed"},
        "ja": {"text": "練習項目は操作に慣れるためだけのもので、分析には含めません。第一印象で回答してください。", "review_status": "translated_draft_unreviewed"},
        "ko": {"text": "연습 문항은 조작에 익숙해지기 위한 것이며 분석에 포함되지 않습니다. 첫인상에 따라 응답하십시오.", "review_status": "translated_draft_unreviewed"}
      }
    },
    {
      "item_id": "item_aesthetic",
      "module": "visual_ratings",
      "construct": "aesthetic",
      "response_type": "likert_1_7",
      "option_set": "rating_1_7_na",
      "required": true,
      "translations": {
        "zh-Hans": {"text": "整体上，这个视觉形式美观吗？", "review_status": "source_draft"},
        "en": {"text": "Overall, is this visual form aesthetically pleasing?", "review_status": "translated_draft_unreviewed"},
        "ja": {"text": "全体として、この視覚形式は美しいですか。", "review_status": "translated_draft_unreviewed"},
        "ko": {"text": "전반적으로 이 시각적 형태가 아름답습니까?", "review_status": "translated_draft_unreviewed"}
      }
    },
    {
      "item_id": "item_premium",